{
  "algorithm": "sha256-counter-v2",
  "id": "heldout-generator",
  "note": "Public sealed samples are generated after development fixtures; official hidden material remains undisclosed.",
  "public_seed": "apb-public-sample-v2",
  "sample_count": 9,
  "schema_version": "1.0",
  "track": "heldout_generator"
}
